{
  "$schema": "https://json-schema.org/draft/2020-12/schema",
  "$id": "https://volatoo.org/schemas/activation-policy-v1.schema.json",
  "title": "Volatoo service activation policy v1",
  "type": "object",
  "additionalProperties": false,
  "required": [
    "schema",
    "target_id",
    "service",
    "init_system",
    "packages",
    "allowed_paths",
    "activation",
    "config_checks",
    "health_checks"
  ],
  "properties": {
    "schema": {
      "const": "org.volatoo.activation-policy/v1"
    },
    "target_id": {
      "type": "string",
      "pattern": "^[a-z0-9][a-z0-9._+-]*(/[a-z0-9][a-z0-9._+-]*)+$"
    },
    "service": {
      "type": "string",
      "pattern": "^[a-z0-9][a-z0-9._-]{0,63}$"
    },
    "init_system": {
      "enum": [
        "openrc",
        "systemd"
      ]
    },
    "packages": {
      "type": "array",
      "minItems": 1,
      "uniqueItems": true,
      "items": {
        "type": "string",
        "pattern": "^[A-Za-z0-9+_.-]+/[A-Za-z0-9+_.-]+$"
      }
    },
    "allowed_paths": {
      "type": "array",
      "minItems": 1,
      "uniqueItems": true,
      "items": {
        "type": "string",
        "pattern": "^/([^/]+/)*[^/]+$"
      }
    },
    "activation": {
      "type": "object",
      "additionalProperties": false,
      "required": [
        "type",
        "unit",
        "argv",
        "rollback_argv"
      ],
      "properties": {
        "type": {
          "enum": [
            "reload",
            "restart",
            "external"
          ]
        },
        "unit": {
          "type": "string",
          "maxLength": 256
        },
        "argv": {
          "$ref": "#/$defs/argv"
        },
        "rollback_argv": {
          "$ref": "#/$defs/argv"
        }
      }
    },
    "config_checks": {
      "type": "array",
      "minItems": 1,
      "items": {
        "$ref": "#/$defs/check"
      }
    },
    "health_checks": {
      "type": "array",
      "minItems": 1,
      "items": {
        "$ref": "#/$defs/health"
      }
    }
  },
  "$defs": {
    "argv": {
      "type": "array",
      "items": {
        "type": "string",
        "minLength": 1,
        "maxLength": 4096
      }
    },
    "check": {
      "type": "object",
      "additionalProperties": false,
      "required": [
        "argv",
        "timeout_seconds"
      ],
      "properties": {
        "argv": {
          "$ref": "#/$defs/argv"
        },
        "timeout_seconds": {
          "type": "integer",
          "minimum": 1,
          "maximum": 300
        }
      }
    },
    "health": {
      "type": "object",
      "additionalProperties": false,
      "required": [
        "argv",
        "timeout_seconds",
        "attempts",
        "interval_seconds"
      ],
      "properties": {
        "argv": {
          "$ref": "#/$defs/argv"
        },
        "timeout_seconds": {
          "type": "integer",
          "minimum": 1,
          "maximum": 300
        },
        "attempts": {
          "type": "integer",
          "minimum": 1,
          "maximum": 60
        },
        "interval_seconds": {
          "type": "integer",
          "minimum": 0,
          "maximum": 300
        }
      }
    }
  }
}
