{"activation":{"argv":[],"rollback_argv":[],"type":"reload","unit":"nginx.service"},"allowed_paths":["/etc/nginx","/usr/lib/systemd/system/nginx.service","/usr/sbin/nginx","/var/db/pkg/www-servers"],"config_checks":[{"argv":["/usr/sbin/nginx","-t"],"timeout_seconds":30}],"health_checks":[{"argv":["/usr/bin/curl","--fail","--silent","--show-error","http://127.0.0.1/"],"attempts":5,"interval_seconds":2,"timeout_seconds":10}],"init_system":"systemd","packages":["www-servers/nginx"],"schema":"org.volatoo.activation-policy/v1","service":"nginx","target_id":"volatoo/amd64/glibc/systemd/23.0/base-v1"}
